{
  "schemaVersion": 1,
  "requestStatus": "completed",
  "operationId": null,
  "operationState": null,
  "result": {
    "repositoryId": "33a1b940-f11d-4d6b-a1a6-4019d7536c68",
    "canonicalHostId": "8b005cff-1fdb-459c-94b2-dbd0ae438fa2",
    "scopeToken": "illustrative-opaque-token-returned-by-service",
    "scope": {
      "integrationBranch": "dev",
      "tip": "aaaaaaaaaaaaaaaaaaaaaaaaaaaaaaaaaaaaaaaa",
      "destination": {
        "remote": "origin",
        "repositoryIdentity": "github.com/example/example-project",
        "branch": "dev"
      },
      "policyRevision": "illustrative-effective-policy-revision"
    },
    "observedAt": "2026-10-04T18:00:00Z",
    "eligible": true,
    "blockers": []
  },
  "error": null
}
