{
  "schemaVersion": 1,
  "requestStatus": "completed",
  "operationId": null,
  "operationState": null,
  "result": {
    "recordMode": "fixture",
    "repositoryId": "33a1b940-f11d-4d6b-a1a6-4019d7536c68",
    "executionHostId": "a2da35a7-11d4-46e5-a6c9-44ed2c6c7b11",
    "canonicalHostId": "8b005cff-1fdb-459c-94b2-dbd0ae438fa2",
    "deviceId": "device-fixture-phone-01",
    "observedAt": null,
    "freshness": "unknown",
    "network": {
      "scenario": "cold_cellular",
      "hostUnderlay": "wifi",
      "phoneUnderlay": "cellular",
      "tailnetPath": "unknown",
      "developerSession": "none",
      "internetState": "unknown"
    },
    "host": {
      "state": "unknown",
      "tailnet": "unknown",
      "reasonCodes": [
        "TAILNET_ROUTE_UNAVAILABLE"
      ]
    },
    "trust": {
      "state": "unknown",
      "observedAt": null,
      "reasonCodes": [
        "PAIRING_REQUIRED"
      ]
    },
    "developerService": {
      "state": "unknown",
      "session": "unknown",
      "sessionRef": null,
      "reasonCodes": [
        "DEVELOPER_SERVICE_UNAVAILABLE"
      ]
    },
    "capabilities": [
      {
        "schemaVersion": 1,
        "recordMode": "fixture",
        "capabilityId": "fixture-go-ios-cold-cellular-install",
        "operation": "install",
        "support": "unverified",
        "context": {
          "host": {
            "hostId": "a2da35a7-11d4-46e5-a6c9-44ed2c6c7b11",
            "model": null,
            "architecture": "unknown",
            "macOSVersion": null,
            "macOSBuild": null,
            "xcodeVersion": null,
            "xcodeBuild": null
          },
          "device": {
            "deviceId": "device-fixture-phone-01",
            "model": null,
            "iOSVersion": null,
            "iOSBuild": null
          },
          "tailscale": {
            "hostVersion": null,
            "deviceVersion": null
          },
          "backend": {
            "id": "go-ios",
            "version": null,
            "revision": null
          },
          "engineVersion": null,
          "network": {
            "scenario": "cold_cellular",
            "hostUnderlay": "wifi",
            "phoneUnderlay": "cellular",
            "tailnetPath": "unknown",
            "developerSession": "none",
            "internetState": "unknown"
          },
          "signingMode": "development",
          "bootstrapMethod": "existing"
        },
        "qualifiedAt": null,
        "evidenceIds": [],
        "limitations": [
          "Illustrative contract record only. Neither target OS versions nor a cold cellular developer connection have been qualified."
        ],
        "reasonCodes": [
          "CAPABILITY_UNVERIFIED"
        ]
      }
    ],
    "availability": [
      {
        "operation": "install",
        "callable": false,
        "capabilityId": "fixture-go-ios-cold-cellular-install",
        "reasonCodes": [
          "CAPABILITY_UNVERIFIED",
          "PREVIOUS_OWNER_UNCONFIRMED"
        ]
      }
    ],
    "ownership": {
      "schemaVersion": 1,
      "recordMode": "fixture",
      "ownershipId": "6c41fc33-df5d-4dcb-966c-24c328478f24",
      "deviceId": "device-fixture-phone-01",
      "ownerHostId": "8b005cff-1fdb-459c-94b2-dbd0ae438fa2",
      "selectedHostId": "a2da35a7-11d4-46e5-a6c9-44ed2c6c7b11",
      "previousHostId": "8b005cff-1fdb-459c-94b2-dbd0ae438fa2",
      "state": "previous_owner_unconfirmed",
      "mutationsPermitted": false,
      "revision": "fixture-ownership-revision-3",
      "activeOperationIds": [
        "fixture-install-uncertain"
      ],
      "leaseExpiresAt": "2026-10-04T22:59:00Z",
      "priorSession": "unknown",
      "releaseReceiptRef": null,
      "recoveryEvidenceRefs": [],
      "externalSession": "unknown",
      "observedAt": "2026-10-04T23:00:00Z",
      "reasonCodes": [
        "PREVIOUS_OWNER_UNCONFIRMED",
        "OUTCOME_UNCERTAIN"
      ]
    },
    "unresolvedOperationIds": [
      "fixture-install-uncertain"
    ],
    "nextActions": [
      {
        "id": "refresh-device",
        "label": "Refresh the selected device status",
        "argv": [
          "contribution",
          "devices",
          "status",
          "--host",
          "a2da35a7-11d4-46e5-a6c9-44ed2c6c7b11",
          "--device",
          "device-fixture-phone-01",
          "--repo",
          "33a1b940-f11d-4d6b-a1a6-4019d7536c68",
          "--refresh",
          "--json"
        ]
      }
    ]
  },
  "error": null
}
